{
  "$schema": "http://json-schema.org/draft-07/schema#",
  "$id": "https://github.com/KIRILL9123/wintune/schemas/profile-schema.json",
  "title": "WinTune Profile",
  "description": "A tuning profile that references tweaks by ID and may inherit from other profiles.",
  "type": "object",
  "properties": {
    "name": {
      "description": "Display name for the profile (Gaming, Workstation, Laptop, Minimal).",
      "type": "string",
      "minLength": 1
    },
    "description": {
      "description": "Human-readable description of what this profile does.",
      "type": "string"
    },
    "inherits": {
      "description": "Parent profile(s) to inherit tweaks from. Child tweaks override parent. Always normalised to array at load time.",
      "oneOf": [
        { "type": "string", "description": "Single parent profile name (e.g. 'base')" },
        {
          "type": "array",
          "items": { "type": "string" },
          "description": "Multiple parent profiles, resolved breadth-first (first = highest priority)"
        }
      ],
      "default": []
    },
    "tweaks": {
      "description": "List of tweak IDs to enable. IDs must match the filenames in src/tweaks/<category>/ (without .ps1).",
      "type": "array",
      "items": { "type": "string", "pattern": "^[a-z0-9]+(-[a-z0-9]+)*$" },
      "uniqueItems": true
    },
    "preserve": {
      "description": "Tweak IDs to explicitly exclude even if inherited from a parent profile.",
      "type": "array",
      "items": { "type": "string" },
      "uniqueItems": true
    },
    "dangerous": {
      "description": "If true, this profile includes tweaks flagged as dangerous. Requires the -Dangerous CLI flag to apply.",
      "type": "boolean",
      "default": false
    }
  },
  "required": ["name", "tweaks"],
  "allOf": [
    {
      "if": {
        "properties": { "dangerous": { "const": true } }
      },
      "then": {
        "description": "Dangerous profiles must include an explanation.",
        "required": ["description"]
      }
    }
  ]
}
