{
  "name": "gaming",
  "description": "Optimized for gaming. Keeps Xbox services, Game Bar; strips telemetry, background apps, and UI animations.",
  "inherits": ["base"],
  "tweaks": [
    "disable-sysmain",
    "disable-wsearch",
    "disable-hibernation"
  ],
  "preserve": [
    "remove-xbox-app",
    "remove-xbox-gaming-overlay",
    "keep-xblauthmanager",
    "keep-xboxgipsvc"
  ],
  "dangerous": false
}
